{
  "schema_version": "0.1.0",
  "id": "food-court-closure",
  "venue": "example-minimal-festival",
  "seed": 42,
  "groups": {
    "share_in_groups": 0.6,
    "mean_size": 3.0
  },
  "compliance": {
    "normal": 0.7,
    "egress": 0.7,
    "evacuation": 0.85
  },
  "description": "Mid-event, the food court access is closed for a medical incident for ten minutes, then reopens.",
  "start_time": "2026-11-14T19:30:00+11:00",
  "duration_s": 2400,
  "mode": "normal",
  "crowd": {
    "total": 6000,
    "spawn": [
      {
        "zone": "main_field",
        "share": 0.5
      },
      {
        "zone": "stage_a_front",
        "share": 0.3
      },
      {
        "zone": "grandstand",
        "share": 0.2
      }
    ],
    "destinations": [
      {
        "id": "food",
        "share": 0.5
      },
      {
        "id": "toilets",
        "share": 0.3
      },
      {
        "id": "first_aid",
        "share": 0.05
      },
      {
        "id": "stage_a",
        "share": 0.15
      }
    ]
  },
  "events": [
    {
      "at_s": 300,
      "type": "closure",
      "threshold": "t_field_food"
    },
    {
      "at_s": 900,
      "type": "reopen",
      "threshold": "t_field_food"
    }
  ]
}
